{
  "artifact_type": "MOBILE_CHECKLIST",
  "case_id": "n31_media_change",
  "completion_log": [],
  "feedback_log": [],
  "interaction_mode": "ONE_STEP_PER_SCREEN",
  "items": [
    {
      "action": "确认设备为汉印 N31，并核对本批折叠热敏标签纸的类型和宽度属于设备支持范围。",
      "check": "设备型号正确，介质为折叠热敏标签纸，纸宽处于手册支持范围。",
      "completed": false,
      "evidence_details": [
        {
          "claim": "N31 用户手册 2 产品规格 项目 直接热敏 203 / (8 / ) 4打印宽度毫米默认 ，最高 25 - 毫米 32 位RISC RA >=2MB >= MB 传感器 ,缺纸侦测 缝标侦测 ,黑标侦测 ,开盖侦测 折叠纸宽度毫米 ,模切或连80 厚度英寸 0 ) 0.00 英寸 22 微米 纸卷直径 卷芯内径英寸 毫米 英寸 毫米 外挂纸卷5 (127 ) TSPL 标签设计驱动,indows000,Win7,8,10 中文英文：GBK：ASCII ts,12×24dots 7",
          "classification": "SOURCE_FACT",
          "evidence_id": "E096",
          "locator": {
            "page": 12,
            "paragraph": "页面全文候选"
          },
          "review_status": "UNREVIEWED",
          "source_ref": "N31_MANUAL_REV1_0",
          "source_type": "pdf"
        },
        {
          "claim": "CONTINUOUS_OPERATION 关键帧候选；等待授权后的视觉理解或人工确认动作、部件和设备状态。",
          "classification": "MODEL_INFERENCE",
          "evidence_id": "E001",
          "locator": {
            "end_ms": 5000,
            "keyframe": "derived/video/N31_VIDEO_OPERATION_FULL/frames/frame_000001.jpg",
            "start_ms": 0
          },
          "review_status": "UNREVIEWED",
          "source_ref": "N31_VIDEO_OPERATION_FULL",
          "source_type": "video"
        },
        {
          "claim": "本批介质为72×130毫米折叠式热敏标签纸，相邻标签有缝隙，背面没有周期性黑标，应使用缝标定位。",
          "classification": "EXPERT_ADVICE",
          "evidence_id": "E144",
          "locator": {
            "end_ms": 68720,
            "start_ms": 40720
          },
          "review_status": "VERIFIED",
          "source_ref": "N31_EXPERT_INTERVIEW",
          "source_type": "audio"
        }
      ],
      "evidence_ids": [
        "E096",
        "E001",
        "E144"
      ],
      "item_id": "CL01",
      "keyframe": {
        "end_ms": 5000,
        "evidence_id": "E001",
        "keyframe": "derived/video/N31_VIDEO_OPERATION_FULL/frames/frame_000001.jpg",
        "preview_path": "output/checklist_thumbnails/S01.jpg",
        "source_ref": "N31_VIDEO_OPERATION_FULL",
        "start_ms": 0,
        "visual_status": "PARTIAL"
      },
      "reason": "完成本步后应确认：设备型号正确，介质为折叠热敏标签纸，纸宽处于手册支持范围。",
      "required": true,
      "risk_level": "WARNING",
      "screen_index": 1,
      "step_id": "S01",
      "title": "核对设备和介质适配性",
      "warnings": [
        "本批实物尺寸72×130毫米由实际操作者口述确认；更换其他介质时重新核对尺寸和设备适配范围。"
      ]
    },
    {
      "action": "查看相邻标签间隙和介质背面，确认存在标签缝隙且没有周期性黑标，将本批介质判定为缝标定位。",
      "check": "能够指出标签间隙，背面未见周期性黑标，并将后续学习模式确定为缝标。",
      "completed": false,
      "evidence_details": [
        {
          "claim": "N31 用户手册 2 产品规格 项目 直接热敏 203 / (8 / ) 4打印宽度毫米默认 ，最高 25 - 毫米 32 位RISC RA >=2MB >= MB 传感器 ,缺纸侦测 缝标侦测 ,黑标侦测 ,开盖侦测 折叠纸宽度毫米 ,模切或连80 厚度英寸 0 ) 0.00 英寸 22 微米 纸卷直径 卷芯内径英寸 毫米 英寸 毫米 外挂纸卷5 (127 ) TSPL 标签设计驱动,indows000,Win7,8,10 中文英文：GBK：ASCII ts,12×24dots 7",
          "classification": "SOURCE_FACT",
          "evidence_id": "E096",
          "locator": {
            "page": 12,
            "paragraph": "页面全文候选"
          },
          "review_status": "UNREVIEWED",
          "source_ref": "N31_MANUAL_REV1_0",
          "source_type": "pdf"
        },
        {
          "claim": "MEDIA_REVERSE_AND_GAP 关键帧候选；等待授权后的视觉理解或人工确认动作、部件和设备状态。",
          "classification": "MODEL_INFERENCE",
          "evidence_id": "E066",
          "locator": {
            "end_ms": 5000,
            "keyframe": "derived/video/N31_VIDEO_MEDIA_TYPE/frames/frame_000001.jpg",
            "start_ms": 0
          },
          "review_status": "UNREVIEWED",
          "source_ref": "N31_VIDEO_MEDIA_TYPE",
          "source_type": "video"
        },
        {
          "claim": "本批介质为72×130毫米折叠式热敏标签纸，相邻标签有缝隙，背面没有周期性黑标，应使用缝标定位。",
          "classification": "EXPERT_ADVICE",
          "evidence_id": "E144",
          "locator": {
            "end_ms": 68720,
            "start_ms": 40720
          },
          "review_status": "VERIFIED",
          "source_ref": "N31_EXPERT_INTERVIEW",
          "source_type": "audio"
        },
        {
          "claim": "本批纸使用缝标学习；按住走纸键，在状态灯第二次闪烁后立即释放，不等待黑标学习对应的后续灯态。",
          "classification": "EXPERT_ADVICE",
          "evidence_id": "E149",
          "locator": {
            "end_ms": 227680,
            "start_ms": 195680
          },
          "review_status": "VERIFIED",
          "source_ref": "N31_EXPERT_INTERVIEW",
          "source_type": "audio"
        },
        {
          "claim": "新手常漏掉介质定位方式判断、内外导纸夹调整，以及装纸后的学习、单张走纸和测试打印。",
          "classification": "EXPERT_ADVICE",
          "evidence_id": "E153",
          "locator": {
            "end_ms": 357600,
            "start_ms": 331760
          },
          "review_status": "VERIFIED",
          "source_ref": "N31_EXPERT_INTERVIEW",
          "source_type": "audio"
        }
      ],
      "evidence_ids": [
        "E096",
        "E066",
        "E144",
        "E149",
        "E153"
      ],
      "item_id": "CL02",
      "keyframe": {
        "end_ms": 5000,
        "evidence_id": "E066",
        "keyframe": "derived/video/N31_VIDEO_MEDIA_TYPE/frames/frame_000001.jpg",
        "preview_path": "output/checklist_thumbnails/S02.jpg",
        "source_ref": "N31_VIDEO_MEDIA_TYPE",
        "start_ms": 0,
        "visual_status": "PARTIAL"
      },
      "reason": "完成本步后应确认：能够指出标签间隙，背面未见周期性黑标，并将后续学习模式确定为缝标。",
      "required": true,
      "risk_level": "WARNING",
      "screen_index": 2,
      "step_id": "S02",
      "title": "判断缝标定位方式",
      "warnings": [
        "不能把无黑标的缝标介质按黑标模式学习。"
      ]
    },
    {
      "action": "确认电源开关处于关闭状态，进纸通道没有残纸、卡纸或异物，标签纸平整且没有明显褶皱。",
      "check": "设备未通电，纸路清洁无阻塞，待装标签纸平整。",
      "completed": false,
      "evidence_details": [
        {
          "claim": "CONTINUOUS_OPERATION 关键帧候选；等待授权后的视觉理解或人工确认动作、部件和设备状态。",
          "classification": "MODEL_INFERENCE",
          "evidence_id": "E009",
          "locator": {
            "end_ms": 45000,
            "keyframe": "derived/video/N31_VIDEO_OPERATION_FULL/frames/frame_000009.jpg",
            "start_ms": 40000
          },
          "review_status": "UNREVIEWED",
          "source_ref": "N31_VIDEO_OPERATION_FULL",
          "source_type": "video"
        },
        {
          "claim": "N31 用户手册 .面向机器正面，双手同时向前拨动顶盖开启钮。 向上掀起顶盖。 将卡住的纸张从进纸通道抽出后，请 褶皱的纸丢弃。 10",
          "classification": "SOURCE_FACT",
          "evidence_id": "E099",
          "locator": {
            "page": 15,
            "paragraph": "页面全文候选"
          },
          "review_status": "UNREVIEWED",
          "source_ref": "N31_MANUAL_REV1_0",
          "source_type": "pdf"
        },
        {
          "claim": "换纸前应确认任务完成或暂停、设备无异常、旧纸正常退出、纸路无残纸卡纸异物且新纸平整；卡纸转异常流程，不强拉。",
          "classification": "EXPERT_ADVICE",
          "evidence_id": "E145",
          "locator": {
            "end_ms": 99600,
            "start_ms": 68720
          },
          "review_status": "VERIFIED",
          "source_ref": "N31_EXPERT_INTERVIEW",
          "source_type": "audio"
        },
        {
          "claim": "异常时先停打，再依次检查装反、歪斜、褶皱和送纸位置，检查内外导轨，核对缝标/黑标及学习模式，重做学习和单张走纸，再查尺寸缩放与驱动。",
          "classification": "EXPERT_ADVICE",
          "evidence_id": "E151",
          "locator": {
            "end_ms": 300400,
            "start_ms": 260400
          },
          "review_status": "VERIFIED",
          "source_ref": "N31_EXPERT_INTERVIEW",
          "source_type": "audio"
        },
        {
          "claim": "不得在进纸或打印时强推强拉扭纸，不送入褶皱破损纸，不把缝标纸按黑标学习，不让导纸夹挤压纸边，不暴力处理卡纸或用硬物刮擦胶辊、传感器和热敏区。",
          "classification": "EXPERT_ADVICE",
          "evidence_id": "E152",
          "locator": {
            "end_ms": 331760,
            "start_ms": 300400
          },
          "review_status": "VERIFIED",
          "source_ref": "N31_EXPERT_INTERVIEW",
          "source_type": "audio"
        }
      ],
      "evidence_ids": [
        "E009",
        "E099",
        "E145",
        "E151",
        "E152"
      ],
      "item_id": "CL03",
      "keyframe": {
        "end_ms": 40000,
        "evidence_id": "E008",
        "keyframe": "derived/video/N31_VIDEO_OPERATION_FULL/frames/frame_000008.jpg",
        "preview_path": "output/checklist_thumbnails/S03.jpg",
        "source_ref": "N31_VIDEO_OPERATION_FULL",
        "start_ms": 35000,
        "visual_status": "PARTIAL"
      },
      "reason": "完成本步后应确认：设备未通电，纸路清洁无阻塞，待装标签纸平整。",
      "required": true,
      "risk_level": "WARNING",
      "screen_index": 3,
      "step_id": "S03",
      "title": "检查初始状态",
      "warnings": [
        "发现卡纸或褶皱介质时转入异常流程，不在标准流程中强拉。"
      ]
    },
    {
      "action": "在电源开关关闭时连接电源线，再打开电源开关并观察状态灯和设备声音。",
      "check": "电源连接牢固，设备完成启动，状态灯没有异常报警。",
      "completed": false,
      "evidence_details": [
        {
          "claim": "CONTINUOUS_OPERATION 关键帧候选；等待授权后的视觉理解或人工确认动作、部件和设备状态。",
          "classification": "MODEL_INFERENCE",
          "evidence_id": "E014",
          "locator": {
            "end_ms": 70000,
            "keyframe": "derived/video/N31_VIDEO_OPERATION_FULL/frames/frame_000014.jpg",
            "start_ms": 65000
          },
          "review_status": "UNREVIEWED",
          "source_ref": "N31_VIDEO_OPERATION_FULL",
          "source_type": "video"
        },
        {
          "claim": "安装介质 处理卡纸 1.面对机器背面，双手同时按住进纸导轨，依据纸张大小，左右调节导轨间距。 3.将卡住的纸张从进纸通道抽出后，将褶皱 4.将卡住的纸抽出后即可进行正常的介 的纸丢弃。 质安装。 2.将标签纸插入进纸导轨， 纸张则会自动吸入。 保修条款 一、本产品热写头片保证寿命为30KM或3个月（以先到为准），如打印头 出现创伤、刮伤、烧毁、腐蚀等不可抗力因素不在保修范围内，其余 部件保修时间为自购买之日起12个月。 充电/开机使用 二、存在以下情况之一者，不属于保修范围之内： 1.确认打印机电源开关处于关闭（O）状态。 1、未经我公司及授权维修人员许可，擅自对产品进行拆卸，或产品序 2.将电源线连接到打印机。 列号标贴被撕去及模糊不清，无法辨认； 3.将电源线另一端连接到附近的插座。 2、由于固体颗粒刮伤热敏头片，引起的打印白线，则头片不属于保修 范围； ！ 注意：请确保标签纸送到位，标签纸将自动从出纸口送出一小段。 3、其他人为引起的故障。 三、保修期内，维修时所更换的产品零配件归我公司所有； 处理卡纸2.手动向上掀起顶盖。 1.面向机器正面，双手同时向前拨动顶 四、用户负责将产",
          "classification": "SOURCE_FACT",
          "evidence_id": "E142",
          "locator": {
            "page": 2,
            "paragraph": "页面全文候选"
          },